,Availability of alcohol,Community and workplace action,Country,Data Source,"Leadership, awareness and commitment",Marketing of alcoholic beverages,Monitoring and surveillance,Pricing policies,Year
0,,, Bulgaria,  ,,,Public funding for an alcohol research project on alcohol consumption.,, 
1,,, Lithuania, link,,,"The Department of Statistics changed the methodology for calculating alcohol consumption, which decreased the level because of the evaluation of tourist consumption.",,2016
2,,, Portugal, link,,,"Publication of “Relatório Anual sobre a Situação do País em Matéria de Álcool, 2015” [“Annual Report on the Situation of the Country Concerning Alcohol, 2015”].",,2016
3,,, Russian Federation,  ,,,"The requirement to be equipped with technical means for recording and transferring information on manufacturing and turnover of ethyl alcohol, alcohol and alcohol-containing products to the Unified State Automated Information System (EGAIS) has been extended to activities in the area of purchase, storage and supply (since 1 January 2016) and retail of alcohol products (since 1 July 2016 for urban areas and since 1 July 2017 for rural areas), as well as alcohol-containing products (paragraph 2 of Article 8 of the Federal Law of 22.11.1995 No. 171-FZ On the State Regulation of the Production and Trading Volume of Ethyl Alcohol and Alcoholic Drinks and on Restricting Consumption (Drinking) of Alcohol Products).",,2016
4,,, Slovenia, link,,,Publication of a report on the recorded alcohol consumption and health consequences of hazardous and harmful drinking in Slovenia.,,2016
5,,, United Kingdom of Great Britain and Northern Ireland,  ,,,England: Public Health England is commissioning research to develop methods to assess the physical and psychological health consequences for children living in families with alcohol problems. It will be published in 2016/17.,,2016
6,,, United Kingdom of Great Britain and Northern Ireland, link,,,Scotland: Publication of “Monitoring and Evaluating Scotland’s Alcohol Strategy: Final annual report.”,,2016
7,,, Hungary, link,,,"National participation in the Joint Action on Reducing Alcohol Related Harm (RARHA).  According to the centrally recorded timeline of the project, the pilot testing of the questionnaire was fulfilled and the full-scale preparation of nationwide testing started.",,2015
8,,, Iceland,  ,,,Regular annual monitoring of determinants of health including alcohol consumption.,,2015
9,,, Italy, link,,,Publicaiton of “L’uso e l’abuso di alcol in Italia – Anno 2014” [“The use and abuse of alcohol in Italy – 2014”].,,2015
10,,, Italy, link,,,Publication of “Osservasalute Report 2014: Rapporto Osservasalute 2014 Stato di salute e qualità dell’assistenza nelle regioni italiane” [“Italian Observatory on Healthcare Report 2014”].,,2015
11,,, Italy, link,,,Report of the Ministry of Health to the Parliament according to the law 125/2001.,,2015
12,,, Italy, link,,,Update of the National Statistical Program (2014–2016),,2015
13,,, Italy, link,,,Publication of “Epidemiologia e monitoraggio alcol-correlato in Italia. Valutazione dell’Osservatorio Nazionale Alcol-CNESPS sull’impatto dell’uso e abuso di alcol ai fini dell’implementazione delle attività del Piano Nazionale Alcol e Salute. Rapporto 2014 [“Epidemiology and alcohol-related monitoring in Italy. Evaluation of the National Observatory on Alcohol-CNESPS on the impact of the use and abuse of alcohol in support for the implementation of the activities of the National Alcohol and Health Plan. Report 2014”].,,2015
14,,, Portugal, link,,,Research study on uses of psychoactive substances and lifestyles of Lisbon University students,,2015
15,,, Portugal, link,,,Research study on alcohol use in pregnancy. The aims were to describe patterns of alcohol use in a sample of pregnant woman who attended primary healthcare facilities in Lisbon and to identify risk/protective factors related to patterns of alcohol use.,,2015
16,,, Portugal, link,,,"Publication of “Relatório Anual sobre a Situação do País em Matéria de Álcool, 2014” [“Annual Report on the Situation of the Country Concerning Alcohol, 2014”].",,2015
17,,, Portugal, link,,,National survey on addictive behaviours in prison settings,,2015
18,,, Portugal, link,,,"Estudo sobre o Consumo de Álcool, Tabaco e Drogas (ECATD), 2015. Alunos de cada grupo etário dos 13 aos 18 anos [Study on Alcohol, Tobacco and Drugs, 2015. Students from each age group from 13 to 18 years], carried out in representative samples, at national level, of each age group. The core questions of the ESPAD questionnaire are used, among others. Data from students aged 16 years are included in the ESPAD. The survey provides epidemiological characterization of alcohol, tobacco and drug use. ",,2015
19,,, Republic of Moldova,  ,,,Participation in WHO International Collaborative Research Project on Child Development and Prenatal Risk Factors,,2015
20,,, Russian Federation,  ,,,"A register for vineyards was established, and a requirement to report on the volume of grapes grown for the manufacturing of wine products was introduced.",,2015
21,,, Slovakia,  ,,,Cross-sectional study on the influence and impact of health education on the prevention of alcohol dependence among people 15 to 29 years.,,2015
22,,, Slovenia, link,,,Publication of a report on the recorded alcohol consumption and health consequences of hazardous and harmful drinking in Slovenia.,,2015
23,,, Slovenia, link,,,Publication of a report on the economic burden of hazardous and harmful drinking in Slovenia.,,2015
24,,, Slovenia, link,,,"Publication of a report on consumption of tobacco, alcohol and illicit drugs in Slovenia.",,2015
25,,, Spain, link,,,Second Encuesta Nacional a Población Gitana [“National Health Survey on the Roma population”] and a comparative study of national health surveys in the Roma population and general population in Spain.,,2015
26,,, Spain, link,,,Publication of the following research papers: “Oleoylethanolamide prevents neuroimmune HMGB1/TLR4/NF-kB danger signaling in rat frontal cortex and depressive-like behavior induced by ethanol binge administration”; “Role of the satiety factor oleoylethanolamide in alcoholism”; and “Epidemiology of alcohol abuse among Spanish immigrant populations.”,,2015
27,,, Switzerland, link,,,(Oct) Publication of:,,2015
28,,, Switzerland, link,,,"Publication of the results of the Health Behaviour in School-aged Children (HBSC) 2014 survey, Switzerland.",,2015
29,,, United Kingdom of Great Britain and Northern Ireland, link,,,Wales: Publication of major report “Reading between the lines: the annual profile for substance misuse 2014-15.”,,2015
30,,, Portugal, link,,,"Inquérito Nacional ao Consumo de Substâncias Psicoactivas na População Geral ‒ Portugal [National Health Inquiry on the Use of Psychoactive Substances – Portugal], 3rd general population survey; includes data on alcohol consumption and defines the assessment of training programmes. ",,2014
31,,, Switzerland, link,,,"Publication of summary report of the Swiss Health Survey regarding Consumption of Alcohol, Tobacco, Pharmaceuticals and illegal drugs (data from 1992, 1997, 2002, 2007, 2012)",,2014
32,,, Switzerland, link,,,Publication of report Risks for alcohol-related diseases and mortality,,2013
33,,, Latvia, link,,,Aizkulises [Backstage]. An informative campaign against illegal alcohol was organized.,,2012
34,,, Portugal, link,,,"Inquérito Nacional em Meio Escolar. Consumo de drogas e outras substâncias psicoactivas ‒ uma abordagem integrada [National School Survey. Drugs and other psychoactive substance use – an integrated approach]. The 2006 and 2011 surveys include two studies, one on students from the third level of basic school (grades 7‒9) and the other from secondary school (grades 10‒12) with national and regional representative samples. The topics covered are related to the epidemiological characterization of alcohol, tobacco and drug use, as well as individual, family, school and community risk factors. ",,2012
35,,, Portugal, link,,,"Estudo sobre o Consumo de Álcool, Tabaco e Drogas (ECATD). Alunos de cada grupo etário dos 13 aos 18 anos [Study on Alcohol, Tobacco and Drugs. Students from each age group from 13 to 18 years], carried out in representative samples, at national level, for each age group. The core questions of the ESPAD questionnaire are used, among others. Data from students aged 16 years are included in the ESPAD. The survey provides epidemiological characterization of alcohol, tobacco and drug use.",,2011
36,,, Portugal, link,,,"Driving Under Influence of Alcohol, Drugs and Medicines; Projet DRUID. Epidemiological study on the prevalence of alcohol, drugs and medicines in general drivers and drivers injured or killed in road accdents, part of a European project.",,2011
0,"Major changes in licensing systems, pertaining to the availability of alcohol",, Bulgaria,  ,,,,, 
1,"The requirements for the retail sale of alcohol were adjusted. Thus, the ban on the retail sale of alcohol in the territories adjacent to educational and medical institutions applies only to areas adjacent to buildings, structures and premises, in which the relevant activities are directly carried out. A direct ban on the retail sale of alcohol remotely was introduced. Agricultural producers are allowed to sell wine produced by them in the markets.",, Russian Federation, link,,,,, 
2,"Despite strong opposition of the Government, professional and nongovernmental organizations, the new initiative of a member of the parliament was adopted. The new Act Restricting the Use of Alcohol (Official Gazette of RS, Nos. 27/17 -ZOPA-A) was adopted on 17 June 2017. According to the ZOPA-A, the sale or offer of alcohol beverages containing less than 15 volume percent of alcohol (e.g., beer and wine, not spirits) can be sold or offered at sport facilities and functional land one hour before the start of and during a public sporting event. The organizer must acquire a permit issued by the administrative unit to sell or offer alcohol beverages at public events. Despite the fact that the act introduced the possibility of the sale and offer of alcohol at sporting events, a doubling of the fines for violating legal provisions were introduced, i.e. for the sale of alcohol to minors or intoxicated people.",, Slovenia, link,,,,,2017
3,Adoption of a law which allows municipalities to introduce a ban on the trading and consumption of alcohol at public events in 2004. More than 30% of municipalities have adopted such bans in 2016,, Lithuania,  ,,,,,2016
4,Ban on the sale of alcoholic beverages in petrol stations (came in to force on 1 January 2016),, Lithuania, link,,,,,2016
5,"The requirements for the retail sale of alcohol in public catering facilities, restaurants, cars, jet aircrafts and, through the mini-bars in hotel rooms were relaxed.",, Russian Federation,  ,,,,,2016
6,Scotland: Publication of Alcohol Focus Scotland’s “Alcohol licensing in your community” toolkit.,, United Kingdom of Great Britain and Northern Ireland, link,,,,,2016
7,Scotland: Scottish Qualifications Authority Alcohol Licensing Qualifications,, United Kingdom of Great Britain and Northern Ireland, link,,,,,2016
8,"Decree of the President of the Republic of Belarus of 20.02.2015 N 92 ""On amendments and additions to the Decree of the President of the Republic of Belarus."" Additional requirements have been set to applicants for a license to carry out wholesale trade and storage of alcoholic beverages.",, Belarus, link,,,,,2015
9,The Law on Public Peace and Order (Official Gazette of Republic of Srpska).  Includes a ban on the sale and use of alcoholic beverages in public places; and a ban on the consumption of alcoholic beverages by persons under age 18 and on the selling and serving of alcoholic beverages to persons under 18 in restaurants and cafes in the Republic of Srpska.,, Bosnia and Herzegovina, link,,,,,2015
10,"The Cyprus Anti-Drugs Council has introduced revisions to the existing legislation for the Sales of Alcoholic Beverages. These include modifications specific to the legal age for consumption and accessibility of alcohol (raising of legal age from 17 to 18) and the introduction of measures and stricter penalties for sellers to minimize underage consumption, and reinforce responsible sales/serving practices. The revisions suggested have been approved by the Ministry of Interior and the revised legislation is expected to be discussed at the parliament level in 2016 or early 2017.",, Cyprus,  ,,,,,2015
11,Changes in the law on the state regulation of licensing and introduction of alcohol production control devices.,, Kazakhstan, link,,,,,2015
12,"Major changes in licensing systems, age limits etc. pertaining to the availability of alcohol: Decreto-Lei n.º 106/2015, de 16 de junho [Decree-Law n.Âº106/2015, of June 16], interdicting the consumption of all kinds of alcohol for minors 18 years.",, Portugal, link,,,,,2015
13,"Decision no. 356 of 11.06.2015 on the approval of the technical regulation ""The organization of the wine market"" which establishes a map of vineyards.",, Republic of Moldova, link,,,,,2015
14,"Act Restricting the Use of Alcohol (Official Gazette of RS, Nos. 15/03- ZOPA) has introduced ban on  selling or offering alcoholic drinks at sports venues during sports events, as well as one hour before the start of such events. In the spring 2015, a member of the parliament tried to lift the ban. The initiative to amend the act so as to again allow the offering and selling of alcoholic drinks at sports events was not adopted since governmental, professional and non-governmental organizations successfully defended the opinion that it would represent a risk and a step back in the development of an effective alcohol policy in Slovenia.",, Slovenia,  ,,,,,2015
15,There were changes in the licensing system and legislation concerning age restrictions.,, Tajikistan,  ,,,,,2015
16,England and Wales: The maximum fine for persistent underage sales of alcohol was made into an unlimited fine.,, United Kingdom of Great Britain and Northern Ireland,  ,,,,,2015
17,"Scotland: Air Weapons and Licensing (Scotland) Act 2015, which includes amendments to the 2005 Act as regards alcohol licensing. The Act 2015 includes the creation of new offences of supplying alcohol to a child or young person for consumption in a public place.",, United Kingdom of Great Britain and Northern Ireland, link,,,,,2015
18,"A mystery shopping programme in  2014-2015 to investigate commitment to  the legal age limit for the sale/serving of alcohol and provide training  for responsible sales and serving of alcohol  for bar staff .  September 2016:  Cyprus Anti-Drugs Council funded a  pilot programme for training for responsible alcohol sales and serving across the country, in all five main cities and areas. 2015:Guidelines for the responsible serving and selling of alcohol were developed by the Cyprus Anti-Drugs Council to facilitate the development of training manuals for the programme as well as other training programmes that will be implemented in the future, since training will be a legal requirement for premises wishing to acquire a license for the sale of alcohol, once the revised legislation has been endorsed by Parliament",, Cyprus,  ,,,,,2014-2015
19,England and Wales: The punitive minimum period of voluntary closure that can be given as an alternative for persistent underage sales was increased to 48 hours and the maximum to two weeks.,, United Kingdom of Great Britain and Northern Ireland,  ,,,,,2012
20,Scotland: A mandatory age verification scheme was implemented,, United Kingdom of Great Britain and Northern Ireland, link,,,,,2011
21,"England and Wales: An offence of persistently selling alcohol to a child was added to the 2003 Licensing Act, so that action can be taken if alcohol was sold on two or more occasions within a three-month period.",, United Kingdom of Great Britain and Northern Ireland,  ,,,,,2006
22,"England and Wales: Licensing Act 2003 has several criminal offences which prevent the sale of alcohol to under 18s, prevent children from being on licensed premises, prohibit an adult from buying alcohol on behalf of a child etc. These came into force in 2005.",, United Kingdom of Great Britain and Northern Ireland,  ,,,,,2005
23,"England and Wales: Voluntary schemes were implemented to check age of drinkers at point of sale to prevent underage drinking, Challenge 21 and Challenge 25.",, United Kingdom of Great Britain and Northern Ireland, link,,,,,2005
0,Presence of ordinances related to selling and serving alcohol in selected local government units.,, Philippines,,,,,,2016
1,Legal permission required for the delivery of alcoholic beverages. Restriction removed for telesales of traditional liquors.,, Republic of Korea,,,,,,2016
2,"Undertook major changes in licensing systems, age limits etc. pertaining the availability of alcohol.",, Vanuatu,,,,,,2016
3,"Passed the Liquor Control (Supply and Consumption) Act in January 2015 and implemented it in April 2015 to mitigate public disorder and disamenities arising from public consumption of alcohol, by restricting the supply and consumption of liquor in public places.",, Singapore,,,,,,2015
4,Introduced the Sale and Supply of Alcohol Act 2012 - new legislation to regulate the sale and supply of alcohol and reduce alcohol-related harm.,, New Zealand,,,,,,2013
5,Implemented Liquor Curtailment at Clarke Quay.,, Singapore,,,,,,2013
6,Banned the sale of alcohol to under-age young people.,, China,,,,,,2012
7,Made major changes in licensing systems for wine and spirits.,, Viet Nam,,,,,,2012
8,"Banned the use, sale, promotion and advertisement of alcohol products in all educational facilities, including schools and universities.",, Cambodia,,,,,,2011
9,Installed touch panels beside cash registers to confirm the age of the purchaser of the liquor.,, Japan,,,,,,2011
10,Increased flexibility for travellers purchasing duty free alcohol.,, Singapore,,,,,,2010
11,Enforced better restrictive control of availability of alcohol.,, Tonga,,,,,,2010
0,,, Bangladesh,,,,A national narcotics and alcohol report was published by Department of Narcotics Control.,,2016
1,,, Thailand,,,,Published a major report on alcohol.,,2016
2,,, Timor-Leste,,,,Conducted an NCD risk factor survey.,,2016
3,,, India,,,,Published report on alcohol industry by Public Health Foundation of India.,,2013
4,,, Thailand,,,,Developed a Youth Network for Surveillance of the Alcoholic Beverage Control Law violations.,,2013
5,,, Thailand,,,,Developed community surveillance and investigated complaints of violations of Alcoholic Beverage Control.,,2011
6,,, Bangladesh,,,,Completed the NCD Risk Factor Survey Bangladesh in 2010.,,2010
7,,, Thailand,,,,Conducted surveillance through collecting information on law violation.,,2010
0,,"Issued revised national guidelines on community action, and on prevention, screening and brief interventions", Cuba,,,,,,2016
1,,Signed an agreement between the Ministry of Health and the Alcoholic Beverages Industry to promote the responsible consumption of alcohol in the population, Dominican Republic,,,,,,2016
0,,, Cambodia,,,,,Increased the excise tax on alcohol products from 25% to 30%.,2016
1,,, Philippines,,,,,Increased the excise tax of alcohol as described in the Presidential Decree 10351.,2016
2,,, Vanuatu,,,,,Made changes in excise duties of alcohol.,2016
3,,, Cambodia,,,,,Increased excise tax on alcohol products.,2014
4,,, Viet Nam,,,,,Increased excise duties of alcohol.,2014
5,,, Tonga,,,,,Increased excise tax on alcohol.,2013
0,,, Iraq,,,,Made major changes in the monitoring system.,,2016
1,,, Morocco,,,,"Commenced standardization of the current national information system. In particular, the national addictions programme is currently working on the standardization and computerization of materials relating to the management of addictions in specialized structures, as well as management protocols (an ongoing project , with the support of the Global Fund and the Catalan Agency of Public Health).",,2016
2,,, Oman,,,,Improved the surveillance system for alcohol and other psychoactive substances.,,2016
3,,, Egypt,,,,Commenced the MED SPAD study to survey alcohol and drugs among adolesents.,,2015
4,,, Egypt,,,,Established the National Drug Observatory. Released the final report of the national alcohol and drug survey. Introduced a new national alcohol and drug survey.,,2014
5,,, Morocco,,,,Published the annual report of the National Observatory of Drugs and Addictions with dissemination of the updated data.,,2014
6,,, Lebanon,,,,"Published a major report on alcohol, and made public funding available from 2013 to 2017 for a major alcohol research project or nationwide action project on alcohol harm prevention and reduction.",,2013
7,,, Morocco,,,,Created the National Observatory of Drugs and Addictions.,,2013
0,,, New Zealand,,,Tabled the evaluations of uptake of voluntary alcohol labelling initiatives at the Australia New Zealand Ministerial Forum on Food Regulation. Ministers agreed to continue the existing trial and to undertake a further review in two years.,,, 
1,,, Cambodia,,,"The Ministry of Information regulated to ban advertisement of alcohol on prime time television, from 6-8 pm.",,,2016
2,,, Republic of Korea,,,Strengthed policies on the content of warning labels on containers of alcoholic beverages.,,,2016
3,,, Viet Nam,,,Created a law on advertising.,,,2013
4,,, Australia,,,"Government responded to the review of food labelling law and policy,  including alcohol labelling.",,,2011
5,,, New Zealand,,,"Australia New Zealand Forum on Food Regulation agreed that warning labels about the risks of consuming alcohol while pregnant should be pursued, but that the industry be given the opportunity to introduce appropriate labelling on a voluntary basis.",,,2011
0,,, Thailand,,,Created major changes in marketing regulations.,,,2016
1,,, Thailand,,,"Notification from the Alcoholic Beverages Control, Regarding Rule, Procedure and Condition for Labels of Alcoholic Beverages.",,,2015
2,,, Thailand,,,Notification from the Alcoholic Beverage Control Committee on the Pattern and Method for the Display of Symbol of Alcoholic Beverages or Symbol of the Company Manufacturing the Alcoholic Beverage.,,,2010
0,,, Bangladesh,,Completed a Mental Health policy draft in 2015.,,,,2016
1,,, Bhutan,,"Conducted a National Level Committee meeting. Formed a Core Implementation Committee. Planned a Stakeholders meeting for September, 2016. Distributed policy to stakeholders.",,,,2016
2,,, India,,Launched and evaluated a long-term nationwide information campaign to reduce alcohol-related harm.,,,,2016
3,,, Myanmar,,Plan by the Ministry of Health and Sports to conduct workshops for alcohol policy development in 2016 .,,,,2016
4,,, Sri Lanka,,Launched the National Alcohol Control. Piloted the Multisectoral Alcohol Prevention programme.,,,,2016
5,,, Thailand,,Created new legislation and a scheme for better enforcement of existing alcohol legislation. Revised and launched a new alcohol strategy and action plan.,,,,2016
6,,, Timor-Leste,,Established a cross-government working group together with partners for fighting drugs and alcohol.,,,,2016
7,,, Bangladesh,,Created a multisectoral action plan for control and prevention of NCDs (2016-2021).,,,,2015
8,,, India,,Adopted the National Policy for Drug Demand Reduction.,,,,2014
9,,, Myanmar,,Conducted a national seminar on the development of policies and strategies for reducing harmful use of alcohol.,,,,2014
10,,, Bangladesh,,"Created the Mental Health Act, Bangladesh and Neurodevelopmental Protection Trust Act, 2013.",,,,2013
11,,, Myanmar,,"According to the new foreign investment law, foreign investment is permitted in liquor production, distilling, bottling businesses but must be done on a joint venture basis with a local partner.",,,,2013
12,,, Thailand,,Created a curriculum project to develop a network of Alcoholic Beverage Control.,,,,2013
13,,, India,,Created a target of 5% reduction in the consumption of alcohol by 2020 and a 10% reduction 2025 for NCD prevention and control in India by The Ministry of Health and Family Welfare.,,,,2012
14,,, Sri Lanka,,Initiated the process of developing an alcohol policy.,,,,2012
15,,, India,,"Published the report 'Alcohol-Related Harm: Implications for public health and policy in India, 2011'.",,,,2011
16,,, Thailand,,Launched a campaign to encourage law enforcement for alcohol control.,,,,2010
0,,, Colombia,,,,,A tax reform for liquors is in legislative process.,2016
1,,, Trinidad and Tobago,,,,,The 2017 National Budget increased the excise duty on locally-manufactured alcoholic products by 20%;  customs duty on imported alcoholic products from the Common Market Origin increased by 20%; and the customs duty payable on alcoholic beverages imported into Trinidad and Tobago from extra-regional sources adjusted to receive equal treatment to that of the common market.,2016
2,,, Chile,,,,,"Tax Reform went into effect, increasing alcohol taxes.",2014
3,,, Grenada,,,,,Increased alcohol taxes.,2014
4,,, Panama,,,,,"Passed Law No. 126, to calculate the alcoholic beverage tax. Approved by the National Assembly in the third debate and in agreement with the alcohol industry and finally with the technical endorsement of the Ministry of Economy and Finances. This tax will produce the collection of approximately 80 million balboas a year, and establishes that 20% will be destined for the Program for Disability, Old Age and Health (IVM) of the Social Security Administration.",2014
5,,, Panama,,,,,Law 15 established a new excise tax on alcoholic beverages.,2013
