6,,, Colombia,,,,,"Enforced regulation on sanitary requirements for the manufacture, elaboration, hydration, packaging, storage, distribution, transportation, commercialization, sale, export and importation of alcoholic beverages destined for human consumption.",2012
7,,, Saint Lucia,,,,,Increased taxes on alcohol (government tax review and implementation of VAT).,2012
8,,, Grenada,,,,,Increased taxes on alcohol.,2011
9,,, Suriname,,,,,"Increased excise taxes on most imported and domestically produced alcohol products. The tax structure differs between fermented and distilled products. Distilled alcohol is taxed in two ways.  A base excise tax may be placed on specific types of spirits (whisky and rum) in addition to a tiered excise tax structure based on the content of alcohol, (i.e. the higher the alcohol content, the higher the tax).  Fermented alcohol products, such as wine and cider, are subjected to either a $0.09 or $0.12 per percent alcohol by volume.",2011
10,,, Dominica,,,,,Increased the excise duties on alcohol.,2010
11,,, Mexico,,,,,Amended the excise tax law for goods and services to raise the tax rate on alcoholic beverages from 50% to 53%.,2010
0,,, Egypt,,,,,Increasing taxes on alcohol.,2013
0,,, El Salvador,,,,Published the National Alcohol Survey 2014. Developed the Alcohol Control Information System.,,2016
1,,, Costa Rica,,,,"Commissioned article to summarize the principal findings of a study done in two Class A hospitals in Costa Rica: ""Alcohol and Injury: study in two national hospital-crossed cases of Costa Rica.",,2015
2,,, Mexico,,,,Issued a national survey on drug and alcohol use in students.,,2015
3,,, Saint Lucia,,,,Developed a data collection instrument and associated indicators for monitoring harm due to alcohol.,,2015
4,,, United States of America,,,,"The CDC Alcohol Program released a study on the ""2010 National and State Costs of Excessive Alcohol Consumption"" in the American Journal of Preventive Medicine (AJPM).",,2015
5,,, Uruguay,,,,Commenced a pilot study on drug use in university students in Uruguay. Disseminated the VI National Household Survey on Drug Use.,,2015
6,,, El Salvador,,,,Conducted the Annual Report 2014.,,2014
7,,, Saint Lucia,,,,Conducted a survey of secondary school population.,,2014
8,,, El Salvador,,,,Conducted the Annual Report 2013.,,2013
9,,, Saint Lucia,,,,Survey conducted on prevalence among women: Multi-Indicator Cluster Survey 2012.,,2012
10,,, Uruguay,,,,Created a global survey on adolescence: 'Adolescence: a world of questions.',,2012
11,,, Canada,,,,"CCSA produced a report analyzing national data to compare drug and alcohol motor vehicle fatalities to better understand the scope of the impact of alcohol-impaired driving,",,2011
12,,, Dominican Republic,,,,Issued a population-based survey on gender and alcohol.,,2011
13,,, Mexico,,,,Registered a national addiction survey to evaluate the problematic consumption of alcohol.,,2011
14,,, Uruguay,,,,Disseminated the 5th national survey in households on drug use.,,2011
15,,, Costa Rica,,,,Conducted a national survey among 12-70 year-olds in households on drug consumption. Found a small reduction in levels of consumption for all ages.,,2010
16,,, Dominican Republic,,,,Issued a population-based survey on gender and alcohol.,,2010
17,,, Panama,,,,Completed an interdisciplinary study on alcohol and related injuries.,,2010
18,,, Uruguay,,,,"Released a subregional report on drug use among students. Second joint study: Information for Designing National and Regional Strategies for Problematic Drug Use in Youth 2009 / 2010. Released a report on drug consumption in prison populations and the relationship between crime and drugs. Released: Subregional Information and Research System on Drugs in Argentina, Bolivia, Chile, Colombia, Ecuador, Peru and Uruguay 2010. Released a report on the relationship between drugs and crime in case of adolescents breaking the law, the experience of Bolivia, Chile, Colombia, Peru and Uruguay. Released: Subregional Information and Research System on Drugs in Argentina, Bolivia, Chile, Colombia, Ecuador, Peru and Uruguay 2010. Released a report on drug use in emergency consultants in Montevideo's Pasteur Hospital.",,2010
0,,, New Zealand,,,,"Released a report on alcohol use, misuse and alcohol-related harm among New Zealanders aged 15 years and over, as part of the New Zealand Health Survey.",, 
1,,, Philippines,,,,Released 2013 Food and Nutrition Research Institute results on NCDs.,,2016
2,,, China,,,,Reported on nutrition and NCDs in China.,,2015
3,,, Malaysia,,,,Reported on the population-based survey on alcohol use in Malaysia.,,2015
4,,, Solomon Islands,,,,Second STEPS survey conducted.,,2015
5,,, China,,,,Published the China alcohol business report 2014-2020.,,2014
6,,, New Zealand,,,,Released the Evaluation of Alcohol and Other Drug Treatment Courts.,,2014
7,,, Australia,,,,Established a collaborative network of alcohol and other drug research centres; National Drug and Alcohol Research Centre (NDARC) at UNSW; National Drug Research Institute (NDRI) at Curtin University; and National Centre for Education and Training on Addiction (NCETA) at Flinders University.,,2013
8,,, China,,,,Launched an alcohol consumption and policies study programme.,,2013
9,,, Mongolia,,,,International alcohol study.,,2013
10,,, New Zealand,,,,Released 2011/12 alcohol use and hazardous alcohol use data.,,2013
11,,, Malaysia,,,,Conducted the Global School-Based Health Survey.,,2012
12,,, Malaysia,,,,Disseminated a population-based survey to determine the national prevalence of alcohol consumption.,,2011
13,,, Solomon Islands,,,,GSHS conducted.,,2011
14,,, China,,,,Commenced surveillance of behavioral risk factors.,,2010
15,,, New Zealand,,,,"Report issued by the Law Commission entitled 'Alcohol in our lives: Curbing the harm ""A report of the review of the regulatory framework for the sale and supply of liquor""'. Released the findings of the 2007/08 New Zealand Alcohol and Drug Use Survey.",,2010
0,The Province of Saskatchewan implemented mandatory server training. The Province of Ontario announced the expansion of alcohol sales to grocery stores and online services.,, Canada,,,,,,2016
1,Operation of the Alcohol and Tobacco Unit to regulate the production and marketing of alcohol.,, El Salvador,,,,,,2016
2,Restricted hours of sale of alcoholic beverages in some Departments.,, Guatemala,,,,,,2016
3,"Established for the first time the legal definition of ""Harmful use of alcohol"" and equated the sale and supply of alcohol to minors with the offense of child corruption.",, Mexico,,,,,,2016
4,Drafted a law to regulate hours of sales of alcoholic beverages.,, Dominican Republic,,,,,,2014
5,"Amended Article 220 of the General Health Law, which equates serving alcohol to the under-aged population with the crime of corrupting people under 18 years.",, Mexico,,,,,,2013
6,"Established technical regulation for health requirements for manufacturing, processing, hydration, packaging, storage, distribution, transport, marketing, sale, export and import of alcoholic beverages for human consumption.",, Colombia,,,,,,2012
7,"Merged laws regarding requirements for issuing licenses to sell alcohol, hours of operation by type of establishment and function, control of advertisements and new addition of sanctions and fines for infractions of the aforementioned.",, Costa Rica,,,,,,2012
8,Created a responsible alcohol service programme with proposal for harm reduction intervention with staff and managers of pubs and other alcohol sellers in two departments of the interior of the country.,, Uruguay,,,,,,2011
0,,, Bahamas,,"Revision/launch of a new alcohol strategy/action plan, parliamentary commission/cross-government working group/national advisory group for alcohol.",,,,2016
1,,, Brazil,,"New legislation for better regulation (Law No. 13,106/2015; which amends Law No. 8,069, of July 13, 1990 - Child and Adolescent Statute) to make it a crime to sell, supply, serve, administer or deliver alcohol to a child. Law No. 13.281 of 4 May 2016 (which amends Law No. 9,503 of 23 September 1997 ""Brazilian Traffic Code"" Art. 165-A): Refusal to undergo a test, clinical examination, skill or other procedure that allows to certify influence of alcohol or other psychoactive substance, in the form established by art. 277: infraction - very serious; penalty - fine (ten times) and suspension of the right to drive for 12 months.",,,,2016
2,,, Canada,,"Report released by Chief Public Health Officer for Canada entitled 'The Chief Public Health Officer's Report on the State of Public Health in Canada, 2015: Alcohol Consumption in Canada'. The Alberta Gaming and Liquor Commission (AGLC) launched '""Thanks Alcohol"" (2015) and ""Enjoy Responsibly"" (2016)- campaigns to promote Canada's Low-Risk Drinking Guidelines and to bring awareness to the dangers of over-consumption/binge drinking.",,,,2016
3,,, Chile,,"Reviewed the strategy and formulation of the Action Plan 2017-2020, which includes the creation of an officially established and permanent interministerial committee for the coordination and monitoring of the action plan.",,,,2016
4,,, Colombia,,"Formulated the intersectoral National Alcohol Plan 2017 - 2021, for the National and World Strategy.",,,,2016
5,,, Cuba,,Launched a national long-term information campaign to reduce the harmful effects of alcohol consumption.,,,,2016
6,,, Dominican Republic,,"Integrated ministries, decentralized ministries and institutions of the state into a working group called the Cluster on Alcohol and Drugs.",,,,2016
7,,, Ecuador,,"Approved the Organic Law for Integral Prevention of the Socioeconomic Phenomenon of Drugs and the Regulation and Control of the Use of Catalogued Substances Subject to Auditing. This law includes the creation of the Technical Secretary on Drugs and the Interinstitutional Committee on Drugs, which issues, coordinates and links public policies related to the socioeconomic phenomenon of drugs, as well as the evaluation of the achievement of the institutional goals and objectives of the Technical Secretary on Drugs.  Launched a national, long-term information campaign to reduce the harmful effects of alcohol consumption: i) The Technical Secretary on Drugs implemented the RETUCO programme.  ii)The Public Health Ministry implemented educational communication material such as videos, myths and facts about the consumption of alcohol, tobacco and other drugs, memes for sharing on social media, methodologies for information on alcohol consumption.",,,,2016
8,,, El Salvador,,Proposed elaboration of the National Strategy for Reducing the Harmful Consumption of Alcohol. Launched national campaigns to prevent the harmful consumption of alcohol.,,,,2016
9,,, Grenada,,"Drafted policy, held several consultations, submitted to the Ministry of Health for review and appropriate action.",,,,2016
10,,, Honduras,,The National Congress negotiated the approval of the law to control alcohol.,,,,2016
11,,, Jamaica,,The Ministry of Health in collaboration with the Pan American Health Organisation and World Health Organisation developed a National Framework for Alcohol Policy.,,,,2016
12,,, Mexico,,"Published the Decree to reform and add different provisions of the general health law on alcoholic beverages, in the Official Gazette of the Federation, which considers the creation of a National Anti-Addiction Council, as well as a Program for the Prevention, Reduction and Treatment of Harmful Use of Alcohol, Attention to Alcoholism and the Prevention of Diseases derived from it, and actions to protect the health of third parties and society from the harmful use of alcohol.",,,,2016
13,,, Suriname,,"The Ministry of Health performed an inventory of existing national policies and practices regarding alcohol control. From this inventory, the Ministry used the 10 recommended target areas, listed in the WHO Global Strategy to Reduce the Harmful Use of Alcohol, to identify national gaps in alcohol control. From there, the Ministry drafted an alcohol-control policy document that included a road map to address and rectify these gaps. This policy document was presented for review to a multi-sectoral audience during a national Health in All Policies workshop hosted by the PAHO country office. Audience feedback was then incorporated into this document.",,,,2016
14,,, Trinidad and Tobago,,Established the Inter-Ministerial Committee in August 2015.,,,,2016
15,,, United States of America,,Released the Interagency Coordinating Council for Prevention of Underage Drinking (ICCPUD) 2015 Report to Congress on Underage Drinking (mandated by the Sober Truth on Preventing Underage Drinking (STOP) Act of 2006). Released the 2015-2020 Dietary Guidelines for Americans (DGA) including information on alcohol.,,,,2016
16,,, Venezuela (Bolivarian Republic of),,"Launched a new alcohol strategy with the parliamentary committee, the intergovernmental working group and the national advisory group dealing with alcohol issues.",,,,2016
17,,, Canada,,Passed a new statute (not yet in force) to implement some of the recommendations from the Liquor Policy Review.,,,,2015
18,,, Colombia,,"Established provisions for Public Health Authority and for  the implementation, monitoring and evaluation of the Public Health Plan for group interventions (PIC).",,,,2015
19,,, Costa Rica,,"Led workshop to validate the ""Alcohol control policy"" by defining the priority interventions to improve public health, and to advance the formulation of an action plan for Costa Rica's alcohol control policy (2016-2019), in the framework of the Global Strategy to Reduce the Harmful Use of Alcohol.",,,,2015
20,,, Cuba,,Media education campaign for preventing the harmful use of alcohol.,,,,2015
21,,, Grenada,,Completed drafting the policy from the Regional Meeting.,,,,2015
22,,, Honduras,,Created legislation to restrict sales of alcohol from 5pm on Sundays to 6am on Mondays.,,,,2015
23,,, Panama,,Organized intersectoral meetings to tackle the issue of alcoholism.,,,,2015
24,,, Saint Lucia,,Collated legal instruments and policy regarding the use of Alcohol in Saint Lucia. Reviewed best practices in alcohol policy implementation.,,,,2015
25,,, Saint Vincent and the Grenadines,,Engaged in a dialogue on the development of alcohol policy.,,,,2015
26,,, Suriname,,Developed an alcohol policy brief: an overview of existing alcohol policies and alcohol practices in Suriname. Started drafting a preliminary National Alcohol policy and plan of action.,,,,2015
27,,, Trinidad and Tobago,,Developed a National Alcohol Policy.,,,,2015
28,,, Uruguay,,"Created an intersectoral commission around public policies for alcohol, directly under the President.",,,,2015
29,,, Canada,,The Province of British Columbia conducted a Liquor Policy Review.,,,,2014
30,,, Costa Rica,,"Led workshop on the use of information for the development of policies and programmes for alcohol, in collaboration with AMRO/PAHO.",,,,2014
31,,, Dominican Republic,,Strengthened the Alcohol Cluster.,,,,2014
32,,, El Salvador,,"FOSALUD maintains a permanent education campaign on the health effects of harmful alcohol use, targeting children and adolescents, health professionals and risky drinkers (2014 theme: ""Alcohol deceives you"" [""El alcohol te engaña""]).",,,,2014
33,,, Grenada,,Drafted the policy from the Regional Meeting.,,,,2014
34,,, Nicaragua,,Created a citizen and human security strategy.,,,,2014
35,,, Peru,,Created Budgetary Program 131 for control and prevention in the area of mental health.,,,,2014
36,,, Saint Lucia,,Collated legal instruments and policy regarding the use of alcohol in Saint Lucia.,,,,2014
37,,, Suriname,,Launched information campaign 'Ya no mi basi!' on the dangers of alcohol by the Ministry of Health.,,,,2014
38,,, Uruguay,,"Held ""First International Symposium: New approaches to the alcohol problem"", organized by the National Drug Board (JND) and the School of Medicine of the University of the Republic of Uruguay (UDELAR). Held Semi-Presential Course and Regional Workshops in ""Brief Interventions and AUDIT and ASSIST Tools"" organized jointly with the MSP and with the support of PAHO and WHO.",,,,2014
39,,, Colombia,,Created a guide for strategic plans for the promotion of responsible consumption of alcohol.,,,,2013
40,,, Dominican Republic,,Published guidelines for reducing alcohol consumption in parents.,,,,2013
41,,, El Salvador,,"FOSALUD is a permanent educational campaign directed towards children and adolescents, health professionals and risky drinkers regarding the health effects of harmful alcohol consumption (2013 theme: Alcohol is winning the race [""El Alcohol te está ganando la batalle""]). Created new technical guidelines for psychoactive substance abuse prevention services.",,,,2013
42,,, Grenada,,Regional Meeting organized by PAHO on policy formulation.,,,,2013
43,,, Jamaica,,Cabinet approved a National Strategic and Action Plan for the Prevention and Control of NCDs including strategy for addressing harmful use of alcohol.,,,,2013
44,,, Cuba,,Organised national workshops for implementing the Alcohol Use Disorders Identification Test (AUDIT).,,,,2012
45,,, Dominican Republic,,Created a guide and protocol for alcohol and drugs.,,,,2012
46,,, Uruguay,,"Revised, updated and printed a guide for preventing alcohol and other drug use in the workplace. Strengthened the alcohol policy by developing a national strategy for reducing the harmful use of alcohol. Its main targets include regulation, control of the production, distribution and sale of alcohol; awareness and prevention; creation of a national care system for harmful alcohol use and a very clear regulation of advertisement. Also includes a consultation period for civil society.",,,,2012
47,,, Cuba,,"Aligned Resolutions 28, 29 and 30 with Law 109 regarding Public Health Ministry (MINSAP) .",,,,2011
48,,, Suriname,,Formalised NCD Action plan 2012-2016. Defined objective: Promote and support reduction of risk factors related to tobacco and alcohol use.,,,,2011
49,,, Canada,,"Developed The National Alcohol Strategy Advisory Committee (NASAC), a multi-stakeholder committee co-chaired by the Canadian Centre on Substance Abuse, MADD Canada, and the Nova Scotia Department of Health and Wellness to pursue the implementation of recommendations under the report 'Reducing Alcohol-Related Harm in Canada: Toward a Culture of Moderation: Recommendations for a National Alcohol Strategy'. NASAC advanced the implementation of recommendations in the priority area of action alcohol pricing.",,,,2010
50,,, Chile,,Published the National Alcohol Strategy.,,,,2010
51,,, Colombia,,"Adopted legislation with measures regarding alcohol consumption, FASD prevention and consumption during pregnancy. Defined  revenues allocated for health, and adopted measures to promote activities that generate resources for health.",,,,2010
52,,, Cuba,,Created the Mental Health Division.,,,,2010
0,,,Cambodia,,Submitted the Draft Law on Alcohol Products Control to the Council of the Ministers for approval.,,,,2016
1,,,Japan,,Developed and released a National Action Plan.,,,,2016
2,,,Lao People's Democratic Republic,,"Held advocacy event and workshop for policy makers, students and  public on the harmful use of alcohol.",,,,2016
3,,,Malaysia,,"Created new legislation and a scheme for the better enforcement of existing alcohol legislation as well as the 	publication of a major report on alcohol. Made changes in excise duties of alcohol, together with 	major changes in licensing systemsand age limits to restrict the availability of alcohol. Issued national guidelines on community action, prevention, screening and brief interventions treatment and  training on alcohol use disorders for health professionals. Offered public funding for a nationwide action project on alcohol.",,,,2016
4,,,Marshall Islands,,"A 1994 act prohibits and controls the sale, use, consumption and production or possession of alcoholic beverages and provides statutory authority for municipalities to administer the prohibition and control of alcoholic beverages.",,,,2016
5,,,New Zealand,,Lauched a Fetal Alcohol Spectrum Disorder (FASD) Action Plan in August 2016.,,,,2016
6,,,Philippines,,"Drafted 2017-2025 strategic plan on Lifestyle Related Diseases addressing the risk factors incluing alcohol  Commission on Higher Education, Department of Labor and Employment and Civil Service Commission issued guidelines on restricting alcohol use in schools, workplace and communities. 	Approval of the Administrative Order # 0039-2016 dated Oct 28, 2016 of the Revised Operational Framework for a Comprehensive National Mental Health Program where alcohol is include Included advocacy on alcohol and rehabilitation of alcohol disorder by the Dangerous Drug Board. Developed a draft of guidelines on the Prevention and Control of Harmful Use of Alcohol.",,,,2016
7,,,Vanuatu,,Revised and launched new alcohol strategy and action plan.,,,,2016
8,,,Japan,,Held an awareness week for alcohol-related problems.,,,,2015
9,,,Malaysia,,Drafted the amendment of the food regulation in 1985 to regulate Compounded Hard Liquors.,,,,2015
10,,,Mongolia,,"Conducted the national ""No Alcohol in Mongolia"" conference on 11th November 2015.",,,,2015
11,,,New Zealand,,"Launched the National Drug Policy 2015-2020, which sets government policy for alcohol and other drugs (AOD).",,,,2015
12,,,Solomon Islands,,Reviewed legislation on alcohol use and established a task force.,,,,2015
13,,,Viet Nam,,Established a cross-government working group. Established the National Steering Committee for alcohol related harms reduction and a national strategy on NCD prevention and control.,,,,2015
14,,,Australia,,"The Government has committed to give funding for the implementation of the National Fetal Alcohol Spectrum Disorders (FASD) Action Plan.  Key priority activities under the Action Plan which are underway include: 	the finalisation of a FASD Diagnostic To, the 	establishment of a FASD Technical etwork, and 	development of a FASD Prevention and Health promotion resource for Aboriginal and Torres Strait Islander women.",,,,2014
15,,,Japan,,Created an awareness week for alcohol-related problems.,,,,2014
16,,,Malaysia,,Launched Malaysia Alcohol Control Action Plan 2013-2020.,,,,2014
17,,,New Zealand,,"Gave recommendations on Alcohol Advertising and Sponsorship. The Government released its response to the Health Select Committee report into child health, including its response to the Committee's recommendations regarding alcohol. The Government announced it would produce an action plan to address Fetal Alcohol Spectrum Disorder.",,,,2014
18,,,Singapore,,"Budget Speech, 2014.",,,,2014
19,,,Viet Nam,,Created a new national policy on alcohol use.,,,,2014
20,,,Cambodia,,Launched the National Policy and Strategic Plan for the reduction of alcohol use.,,,,2013
21,,,Japan,,Commenced the second term of the National Health Promotion Movement in the 21st century (Health Japan 21) (to March 2022).,,,,2013
22,,,Malaysia,,Malaysia's Alcohol Control Action Plan 2013-2020.,,,,2013
23,,,New Zealand,,"The Health Select Committee presented to Parliament their report into improving child health outcomes and preventing child abuse. The report contains over 130 recommendations, including some relating to alcohol advertising and sponsorship, and Fetal Alcohol Spectrum Disorder.",,,,2013
24,,,Australia,,One million brochures distributed through alcohol outlets at the point of sale to promote the Guidelines' message regarding alcohol use during pregnancy and breastfeeding.,,,,2012
25,,,China,,Created a national plan for NCD control and prevention.,,,,2012
26,,,Solomon Islands,,Commenced review of the Liquor Act.,,,,2012
27,,,China,,Published core information for promoting a healthy lifestyle.,,,,2011
28,,,New Zealand,,Health Promotion Agency established (a new Crown entity with functions that include alcohol).,,,,2011
29,,,Republic of Korea,,"Updated national alcohol action plan developed in 2006. The Bluebird Plan 2020 describes vision, objectives, and activities the government should implement to reduce harms associated with alcohol use by the year of 2020. However, the plan failed to secure parliamentary endorsement and enough financial resources to implement in full.",,,,2011
30,,,Australia,,Increased funding for the National Binge Drinking Strategy.,,,,2010
31,,,Malaysia,,Created a Healthy Lifestyle Campaign including 'live healthy without alcohol'.,,,,2010
32,,,Solomon Islands,,Drafted the National Alcohol Strategy and Action Plan.,,,,2010
0,,Implemented the mhGAP Intervention Guide in 3 provinces., Afghanistan,,,,,,2016
0,,Created alcohol-free communities., Kiribati,,,,,,2016
1,,"Issued national guidelines on community action, prevention, screening and brief interventions treatment.", Vanuatu,,,,,,2016
2,,Initiated a community-based alcohol prevention programme., Malaysia,,,,,,2014
3,,Issued guidelines for alcohol-screening and intervention for a community-based project., Malaysia,,,,,,2013
4,,Recovery programme and training conducted with churches., Solomon Islands,,,,,,2013
0,,, Sweden, link,,,,Excise tax increasw on spirits 1% and on wine and beer 4%.,2017
1,,, Lithuania, link,,,,Launch of a plan to increase excise duty for four years.,2016
2,,, Lithuania, link,,,,"Launch of the State Public Health Promotion Foundation, funded by alcohol and tobacco excise taxes (came in to force on 1 January 2016).",2016
3,,, Portugal,  ,,,,The excise duty shall be annually revised in accordance with the procedure laid down by the State Budget Law,2016
