4,,, Republic of Moldova,  ,,,,"Draft of the Tax Policy Law 2017 provides for the following: No excise exemption for non-denaturated ethyl alcohol which is used by taxable entities dealing both in manufacturing cosmetics and manufacturing and selling alcoholic beverages. The change is aimed at preventing application of the excise exemption for non-denaturated ethyl alcohol to products used for purposes other than those of cosmetics manufacturing. It is proposed to adjust the excise rates, which are fixed sums for alcoholic beverages, by the inflation rate projected for 2017-2019 (5%). It is proposed also in the middle term to harmonize excise rates for alcoholic beverages with EU Directives.",2016
5,,, Russian Federation,  ,,,,"On 1 June 2016, the minimum retail price for 0.5 litres of vodka was raised to 200 rubles.",2016
6,,, Slovenia, link,,,,"Excise Duty Act 2016: Article 71 (Excise duty base and the amount of excise duty: a) the excise duty base for wine and other fermented and intermediate beverages shall be the quantity of excise products, measured in hectolitres, while for beer and ethyl alcohol, it shall be the total alcoholic  strength of one hectoliter; b) excise duty shall be paid in the amount of:  EUR 12.10 for 1 vol. % alcohol for one hectolitre of beer; EUR 0 for one hectolitre of still wine; EUR 0 for one hectolitre of sparkling wine; EUR 0 for one hectolitre of other fermented beverages; EUR 132.00 for one hectolitre of intermediate beverages; EUR 1,320.00 for 100 vol. % of alcohol for one hectolitre of ethyl alcohol.Introduced increased quantities of wine and beer for own use (600 litres of wine/household/per year, 500 litres of beer/household/per year).",2016
7,,, Turkey, link,,,,"In 2012, by Article 12 of the Special Consumption Tax Law No.4760, the Council of Ministers is authorized to determine tax arrangements for spirits. By this authority, different tax rates based on the degree of alcohol, the amount of alcohol and the minimum tax amount are determined twice a year. In this context, tax regulation was carried out two times a year in 2016.",2016
8,,, United Kingdom of Great Britain and Northern Ireland, link,,,,Publication of the revised Her Majesty's Revenue and Customs (HMRC) Alcohol Strategy in March 2016.,2016
9,,, Bosnia and Herzegovina,  ,,,,Increase in the excise taxes on alcohol.,2015
10,,, Greece,  ,,,,Increase in alcohol taxation. Introduced taxes on wine (Ministerial Decision B 5026381/2015 of the Ministry of Economy).,2015
11,,, Hungary, link,,,,"The modification of Act CXXVII of 2003 on Excise Duties and Special Regulations on the Distribution of Excise Goods resulted in: a) a modification of the definition of “private distillation,” which presently denotes production of a maximum of 50 litres of pure alcohol per year using private distilling equipment with a maximum volume of 100 litres in the private distiller’s place of residence or orchard by the private distiller; and b) an increase in the tax levied on subcontracted distilled beverages made of raw material of the owner.",2015
12,,, Hungary, link,,,,"Modification of Act CIII of 2011 on Public Health Product Tax: newly established point i) of article 2 of the Act levies a health product tax to be paid on alcohol products (spirits) with the exception of distilled fruits beverages (Palinka) and spirits containing a minimum of seven medicinal herbs. Some alcoholic beverages, such as flavoured beer and alcoholic refreshments (alco-pops), have been under the public health product tax since 2012. Point h) of article 6 applies differentiated grading on alcoholic drinks according to their pure alcohol content as per volume percent (v/v %): higher than 1,2 v/v % and not higher than 5 v/v % HUF: 20 per litre; higher than 5 v/v % and not higher than 15 v/v % HUF: 100 per litre; higher than 15 v/v % and not higher than 25 v/v % HUF: 300 per litre; higher than 25 v/v % and not higher than 35 v/v % HUF: 500 per litre; higher than 35 v/v % and not higher than 45 v/v % HUF: 700 per litre; higher than 45 v/v % HUF 900 per litre.",2015
13,,, Latvia, link,,,,Increases in excise duties on alcohol (“Likums par Akcīzes nodokli” [“Law on excise duty”]).,2015
14,,, Republic of Moldova, link,,,,"Amendment to the Fiscal code of the Republic of Moldova, increasing the excise tax on alcohol.",2015
15,,, Romania, link,,,,"Law 227/08.09.2015, published in the Official Monitor of Romania no. 688/10.09.2015 concerning the Fiscal Code that will come into force on 1 January 2016. Section 4 of the Fiscal Code regulates alcohol and alcoholic beverages, especially the level of excise duty tax. In general, the excise duty tax decreased for all types of alcoholic beverages.",2015
16,,, Russian Federation,  ,,,,Introduction of a reduced excise duty on wines with a protected designation /geographical indication.,2015
17,,, Sweden, link,,,,Excise tax increase on spirits 1% and on wine and beer 9%.,2015
18,,, Tajikistan,  ,,,,Excise taxes on alcohol were increased.,2015
19,,, Turkey, link,,,,"In 2012, by Article 12 of the Special Consumption Tax Law No.4760, the Council of Ministers is authorized to determine tax arrangements for spirits. By this authority, different tax rates based on the degree of alcohol, the amount of alcohol and the minimum tax amount are determined twice a year. In this context, tax regulation was carried out two times a year in 2015.",2015
20,,, Turkmenistan,  ,,,,"Increase in excise taxes. Article 119 ""The list of excisable goods and excise rates"". In the edition of the law of Turkmenistan of 10 May 2010. Decree of the President of Turkmenistan No. 14413 of 23 September 2015 ""Starting from 01.04.2016 to introduce marking imported into Turkmenistan for the purpose of selling tobacco products and alcoholic beverages, as well as additional alcoholic beverages produced in Turkmenistan.""",2015
21,,, United Kingdom of Great Britain and Northern Ireland,  ,,,,Excise Movement and Risk Analysis introduced in 2015.,2015
22,,, United Kingdom of Great Britain and Northern Ireland, link,,,,Wales: Consultation on the draft Public Health (Minimum Price for Alcohol) (Wales) Bill. Consultation launched 15 July 2015 and closed 11 December 2015.,2015
23,,, Uzbekistan,  ,,,,Ministry of Finance of the Republic of Uzbekistan Regulation No. 102 of 3 December 2015 and Tax Committee of the Republic of Uzbekistan Regulation No. 2015-34 of 3 December 2015 on Revision of Minimum Wholesale and Retail Prices on Alcohol Products.,2015
24,,, Russian Federation, link,,,,"Decree of the Russian Service for Alcohol Market Regulation from 25.12.2014 № 409 ""On the pricing, which is carried out not less than the purchase (excluding imports), supplies (except for exports) and retail sale of alcoholic beverages fortress over 28 percent"".  Since 1 February 2015, the minimum retail price for a 0.5-litre bottle of vodka has been reduced from 220 RUR to 185 RUR.",2014
25,,, Russian Federation, link,,,,"The Treaty on the EEU included the following provisions: countries’ ability to regulate prices on vodka, liquor and other alcoholic beverages (≥28%) (minimal price) (paragraph 85); harmonization (convergence) of excise tax rates for the most sensitive excisable goods (paragraph 71); according to point 14 of the List of sectors (subsectors) of services in which the single market of services within the framework of the EEU is functioning, approved by the Decision of the Supreme Eurasian Economic Council of 23 December 2014 No. 110, and also in accordance with the Decision of the Supreme Eurasian Economic Council of 23 December 2014 No. 112, services in the retail sale of ethyl alcohol, alcohol and alcohol-containing products are an exception to the single market within the framework of the EEU.",2014
26,,, Russian Federation, link,,,,"The Treaty on the Eurasian Economic Union (EEU), signed in Astana on 29 May 2014. The list of sectors (subsectors) of services, which operate a single market for services within the framework of the EEU, was approved by the decision of the Supreme Eurasian Economic Council from 23.12.2014 N 110, and according to the decision of the Supreme Eurasian Economic Council of 23.12.2014 N 112.",2014
0,,, El Salvador,,,,Published the National Alcohol Survey 2014. Developed the Alcohol Control Information System.,,2016
1,,, Costa Rica,,,,"Commissioned article to summarize the principal findings of a study done in two Class A hospitals in Costa Rica: ""Alcohol and Injury: study in two national hospital-crossed cases of Costa Rica.",,2015
2,,, Mexico,,,,Issued a national survey on drug and alcohol use in students.,,2015
3,,, Saint Lucia,,,,Developed a data collection instrument and associated indicators for monitoring harm due to alcohol.,,2015
4,,, United States of America,,,,"The CDC Alcohol Program released a study on the ""2010 National and State Costs of Excessive Alcohol Consumption"" in the American Journal of Preventive Medicine (AJPM).",,2015
5,,, Uruguay,,,,Commenced a pilot study on drug use in university students in Uruguay. Disseminated the VI National Household Survey on Drug Use.,,2015
6,,, El Salvador,,,,Conducted the Annual Report 2014.,,2014
7,,, Saint Lucia,,,,Conducted a survey of secondary school population.,,2014
8,,, El Salvador,,,,Conducted the Annual Report 2013.,,2013
9,,, Saint Lucia,,,,Survey conducted on prevalence among women: Multi-Indicator Cluster Survey 2012.,,2012
10,,, Uruguay,,,,Created a global survey on adolescence: 'Adolescence: a world of questions.',,2012
11,,, Canada,,,,"CCSA produced a report analyzing national data to compare drug and alcohol motor vehicle fatalities to better understand the scope of the impact of alcohol-impaired driving,",,2011
12,,, Dominican Republic,,,,Issued a population-based survey on gender and alcohol.,,2011
13,,, Mexico,,,,Registered a national addiction survey to evaluate the problematic consumption of alcohol.,,2011
14,,, Uruguay,,,,Disseminated the 5th national survey in households on drug use.,,2011
15,,, Costa Rica,,,,Conducted a national survey among 12-70 year-olds in households on drug consumption. Found a small reduction in levels of consumption for all ages.,,2010
16,,, Dominican Republic,,,,Issued a population-based survey on gender and alcohol.,,2010
17,,, Panama,,,,Completed an interdisciplinary study on alcohol and related injuries.,,2010
18,,, Uruguay,,,,"Released a subregional report on drug use among students. Second joint study: Information for Designing National and Regional Strategies for Problematic Drug Use in Youth 2009 / 2010. Released a report on drug consumption in prison populations and the relationship between crime and drugs. Released: Subregional Information and Research System on Drugs in Argentina, Bolivia, Chile, Colombia, Ecuador, Peru and Uruguay 2010. Released a report on the relationship between drugs and crime in case of adolescents breaking the law, the experience of Bolivia, Chile, Colombia, Peru and Uruguay. Released: Subregional Information and Research System on Drugs in Argentina, Bolivia, Chile, Colombia, Ecuador, Peru and Uruguay 2010. Released a report on drug use in emergency consultants in Montevideo's Pasteur Hospital.",,2010
0,,, Sweden, link,"National Commission for Equality in Health. The end report included two concrete propositions for the alcohol area: i) Alcoholic beverages excise tax rate to be revised yearly and linked to inflation, ii) Sweden to work in EU for a Framework Convention on Alcohol Control.",,,,2015-2017
1,,, Austria, link,Plan to harmonize youth protection regulations across all states is included in the government programme (December 2017),,,,2017
2,,, Austria, link,"First “Dialogwoche Alkohol”: universal prevention campaign across Austria, 15–21 May 2017",,,,2017
3,,, Germany, link,The national prevention and awareness raising campaign “Alkohol? Kenn Dein Limit” [“Know your limit”] was relaunched in 2017.,,,,2017
4,,, Luxembourg,  ,"First alcohol prevention week in German-speaking countries (Luxembourg, Germany, Austria and Lichtenstein)",,,,2017
5,,, Austria,  ,Adoption of the first written National Strategy on the Prevention of Addiction by the Ministers' Council on 26 January 2016.,,,,2016
6,,, Belarus, link,"A Decree of the Council of Ministers dated 09.06.2016 №445 ""On the Interdepartmental Council on the formation of a healthy lifestyle, control of noncommunicable diseases, prevention of alcoholism, drug addiction and consumption of tobacco and tobacco products under the Council of Ministers of the Republic of Belarus.",,,,2016
7,,, Belarus, link,"A Decree of the Council of Ministers dated 14.03.2016 №200 on approval of the State program ""Health of the Nation and the demographic security of the Republic of Belarus"" 2016–2020.",,,,2016
8,,, France, link,Rapport de la cour des comptes sur les politiques alcool [Report of the Court of Auditors on policies against harmful consumption of alcohol].,,,,2016
9,,, Israel,  ,The Alcohol National Strategy Programme was audited by the government auditor office.,,,,2016
10,,, Lithuania, link,Launch of an action plan to address alcohol-related problems and the establishment in Parliament of a permanent Commission for the Prevention of Drug and Alcohol Addiction.,,,,2016
11,,, Luxembourg,  ,A written national policy is being developed. It is currently being validated by the Government (Council of Government) and the Minister of Health.,,,,2016
12,,, Malta,  ,A draft national policy has been published and is currently being circulated for public consultation.,,,,2016
13,,, Montenegro,  ,Law on wine.,,,,2016
14,,, Portugal,  ,Revision/launch of a new alcohol strategy/action plan.,,,,2016
15,,, Russian Federation,  ,"The concept of informing the population of the Russian Federation about the dangers of alcohol abuse (Russian Ministry of Health Order from 30.06.2016 N 448 ""On Approval of the Concept of the Russian Federation to inform people about the dangers of alcohol abuse"") was developed in accordance with the plan of measures on stabilization of the situation and the development of competition in the alcoholic market (the order of the Government of the Russian Federation dated 26 November 2015 № 2413-p), the Concept of implementation of the state policy to reduce the abuse of alcoholic beverages, and prevention of alcoholism among the population of the Russian Federation for the period until 2020 (decree of the Russian Government dated 30 December 2009 . № 2128-p), and the national security Strategy of the Russian Federation (approved by Presidential Decree of December 31, 2015 № 683).",,,,2016
16,,, Slovenia, link,"The 7th European alcohol policy conference (7EAPC) was hosted by the Ministry of Health in Slovenia and co-organized by the European Alcohol Policy Alliance in November 2016.  The theme of 7EAPC was alcohol policy for sustainable development. 7EAPC was attended by 278 representatives from 48 countries. The conference was attended by high-level officials from most European countries, the World Health Organization and the European Commission. The two days were full of plenary sessions and workshops, most of which focused on developments within the sub-themes of alcohol inequalities and innovative approaches.",,,,2016
17,,, Spain, link,Finalization of the Action Plan on Drugs (2013–2016),,,,2016
18,,, Spain, link,Participation in the “Listen first” marketing campaign.,,,,2016
19,,, Spain, link,"Launch of the “Healthy Lifestyles” website of the Spanish Ministry of Health. The purpose is to provide citizens with information and web resources about healthy lifestyles, including avoiding harmful alcohol consumption.",,,,2016
20,,, Sweden, link,"A revised national strategy for Alcohol, Narcotics, Doping and Tobacco (ANDT) Policy was adopted in February 2016, for the period 2016–2020.",,,,2016
21,,, Switzerland, link,(6/Apr) Federal Council adopts National Strategy on Noncommunicable Diseases 2017–2024,,,,2016
22,,, Switzerland, link,(6/Apr) Federal Council adopts draft version for a first partial revision of Alcohol Act and transfers it to Parliament.,,,,2016
23,,, United Kingdom of Great Britain and Northern Ireland,  ,Scotland: Scottish Government is currently undertaking a formal review of the Child Protection system in Scotland which will make recommendations by the end of 2016.,,,,2016
24,,, United Kingdom of Great Britain and Northern Ireland, link,"England: Public Health England’s “One You” campaign, launched 2016, aims to motivate people to take steps to improve their health through action on the main risk factors, such as smoking, inactivity, obesity, and alcohol consumption.  It provides a Drinks Tracker app to help drinkers identify risky behaviour and lower their alcohol consumption.",,,,2016
25,,, United Kingdom of Great Britain and Northern Ireland, link,Wales: Publication of the substance misuse delivery plan: “Working together to reduce harm: delivery plan 2016-2018.”,,,,2016
26,,, United Kingdom of Great Britain and Northern Ireland, link,Northern Ireland: Alcohol awareness week runs in June.,,,,2016
27,,, Azerbaijan, link,"The Azerbaijan National Strategy for the Prevention and Control Of NCDs 2015–2020 was approved by the President of Azerbaijan in December 2015. The Strategy includes objectives related to implementing efficient and equity-based interventions in order to reduce the main modifiable risk factors for NCDs: tobacco use, harmful use of alcohol, unhealthy diet and physical inactivity. The Action Plan has a separate component related to alcohol (9.2.1.2 - Reducing harmful use of alcohol). The specific activating include to revise and update the legislation with special emphasis on the following: restricting the access of children to retailed alcohol; ensuring the enforcement of restrictions and bans on alcohol advertising; ensuring the enforcement of the ban on drink-driving; raising taxes on alcohol; updating a price/sale policy on alcohol; and conducting educational events at educational institutions about the negative impact of alcohol on health.",,,,2015
28,,, Croatia,  ,"The national campaign “Turn on your conscience - sometimes you need to say NO to children” was initiated by members of the Croatian Chamber of Commerce Association of beer malt and hop producers, in collaboration with the Ministry of Health. The campaign calls for the consistent implementation of the law banning the consumption of alcohol by and sale of alcoholic beverages to persons under 18 years",,,,2015
29,,, Cyprus, link,Cyprus Anti-Drugs Council provides funding for national prevention programmes for the reduction of alcohol-related harm,,,,2015
30,,, Czechia,  ,Launch of the National Action Plan Against the Harmful Effects of Alcohol,,,,2015
31,,, Finland, link,"Ehkäisevän päihdetyön toimintaohjelma. Alkoholi-, huume- ja rahapelihaittojen sekä tupakoinnin vähentäminen. Sosiaali- ja terveysministeriö, 2015 [Action Plan to prevent harms from alcohol, tobacco, drugs and gambling. Ministry of Social Affairs and Health, 2015]. The action plan, which runs from 2016-2025, builds on the preceding national alcohol programme and integrates prevention activities across substances/addictions.",,,,2015
32,,, Finland, link,"Laki ehkäisevän päihdetyön järjestämsiestä, No. 523/2015 [Act on organizing alcohol, tobacco, drugs and gambling prevention]. The Act gave a legal basis to the regional coordination structure established in 2011 and to the national lead role of the Institute for Health and Welfare. The Act established common standards for the multi-actor work organized at the local level by municipalities.",,,,2015
33,,, Finland, link,"The campaign “Lasten seurassa” [“In the company of children”] has been run since 2009 as a central part of the alcohol retail monopoly’s responsibility activities. The latest video clip, “The orphanage”, launched in 2015, highlights the theme “children don’t get to choose”.",,,,2015
34,,, France, link,Loi n° 2016-41 du 26 janvier 2016 de modernisation de notre système [The law No. 2016-41 of 26 January 2016 to modernize our health system] includes alcohol measures.,,,,2015
35,,, Georgia, link,New legislation/scheme for better enforcement of existing alcohol legislation.,,,,2015
36,,, Germany, link,"The national prevention and awareness raising campaign “Alkohol? Kenn Dein Limit” [“Know your limit”] was implemented to raise awareness of the general public and relevant services on health and social harm from heavy episodic drinking (e.g., through events, publications, information material).",,,,2015
37,,, Germany, link,"Adoption of the Health Target “Alkoholkonsum reduzieren“ (“Reduce alcohol consumption”) and its citation in the “Präventionsgesetz, PrävG” (“Prevention Law”), adopted in 2015, as one of eight Health Targets",,,,2015
38,,, Germany, link,"Aktionswoche Alkohol (Alcohol Awareness Week ""Alcohol? Less is better!"") has been carried out every two years since 2007 to raise awareness of national legislation among sellers of alcoholic beverages and the general public.",,,,2015
39,,, Iceland,  ,"Launch of a website  with information for the public on alcohol, including self-monitoring and guidelines to reduce alcohol consumption.",,,,2015
40,,, Ireland,  ,"The Health Service Executive funded the REACT Project (REACT (Responding to Excessive Alcohol Consumption in Third Level), creating evidence-based policies and tools for third-level institutions to reduce alcohol-related harm",,,,2015
41,,, Ireland, link,"The Public Health (Alcohol) Bill is in the Programme for a Partnership Government, and the Government is keen to have it enacted. The Bill completed its passage through all stages in the Seanad on 15 December 2017. The Minister intends to bring the Bill into the Dáil as soon as possible in 2018.The Public Health (Alcohol) Bill contains a suite of meaningful measures to reduce the level of harmful consumption of alcohol in Ireland. The aim of the legislation is to reduce alcohol consumption and the harms caused by alcohol. The Bill includes provisions for minimum unit pricing; health labelling of alcohol products; the regulation of advertising and marketing of alcohol; the regulation of sponsorship; separation of alcohol products in mixed trading retail outlets; andthe regulation of the sale and supply of alcohol in certain circumstances",,,,2015
42,,, Latvia,  ,Revision and publication of a report on the “Alkoholisko dzērienu patēriņa mazināšanas un alkoholisma ierobežošanas rīcības plāns 2012.–2014. gadam” [“Action plan for reduction of consumption of alcoholic beverages and limitation of alcoholism 2012–2014”].,,,,2015
43,,, Latvia, link1,An informative campaign (animated film) was carried out to support parents in communicating with adolescents about alcohol.,,,,2015
44,,, Latvia, link2,An informative campaign (animated film) was carried out to support parents in communicating with adolescents about alcohol.,,,,2015
45,,, Montenegro,  ,Draft law on strong alcoholic beverages.,,,,2015
46,,, Netherlands, link,"The Health Council of the Netherlands published their guidelines on healthy nutrition, including a new guideline on alcohol consumption.",,,,2015
47,,, Norway,  ,"Escalation plan for alcohol and drug related services (2016–2020), Proposition 15.S (2015–2020)",,,,2015
48,,, Norway, link,"Publication of “Mestring og muligheter. Folkehelsemeldingen St. medl 19 (2014–15)   27/6 2015” (“Mastering and possibilities. Report no. 19 to the Parliament 2014–15 on public health”). This white paper covers the public health field at local, regional and national levels and most sectors of society",,,,2015
49,,, Poland,  ,Public funding for major alcohol research project or nationwide action project on alcohol harm prevention and reduction.,,,,2015
50,,, Portugal, link,"A campaign to prevent the consumption of alcoholic beverages during pregnancy and breastfeeding was launched in September 2015 by Clube de Criativos de Portugal[“Portugese Creative Club”] in partnership with the General Directorate for Intervention on Addictive Behaviours and Dependencies (SICAD), within the scope of the Alcohol and Health Forum.",,,,2015
51,,, Portugal, link,Launch/evaluation of a long-term nationwide information campaign to reduce alcohol-related harm.,,,,2015
52,,, Romania,  ,Ministerial Order of the Minister of Health 1367/02.11.2015 establishing the components of the technical secretariat of the National Council.,,,,2015
53,,, Romania, link,"Governmental Decision 160/11.03.2015, published in the Official Monitor of Romania no. 891/08.12.2014 concerning the creation of the National Council for the coordination of policies and actions aiming to reduce the harmful use of alcohol in Romania. The Council is acting under the coordination of the Ministry of Health. The Council has three bodies: the interministerial committee, the technical secretariat and the consultative committee. The Council is responsible for developing the national action plan to reduce the harmful use of alcohol in Romania",,,,2015
